{
  "$comment": "GENERATED by contracts/codegen/generate.py from operational_event.schema.yaml - DO NOT EDIT.",
  "$schema": "https://json-schema.org/draft/2020-12/schema",
  "additionalProperties": true,
  "description": "An append-only operational lifecycle event (polymorphic by event_type) \u2014 CONTRACT \u00a73, B-8/B-9 (OQ-3).",
  "properties": {
    "as_of": {
      "description": "The as-of timestamp the change resolves against (event-sourcing; \u00a73, B-8/OQ-6).",
      "type": [
        "string",
        "null"
      ]
    },
    "entity": {
      "description": "Which operational entity type this concerns \u2014 OPEN string, WARN-checked vs the \u00a73 entity set (OQ-9 pattern).",
      "minLength": 1,
      "type": "string"
    },
    "entity_id": {
      "description": "The entity instance the event is about.",
      "minLength": 1,
      "type": "string"
    },
    "event_id": {
      "description": "The event's own id (the anchor; append-only idempotency).",
      "minLength": 1,
      "type": "string"
    },
    "event_type": {
      "description": "The discriminator \u2014 OPEN string (hard-present), WARN-checked vs the known lifecycle set (OQ-A; never a hard enum).",
      "minLength": 1,
      "type": "string"
    },
    "payload": {
      "description": "OPAQUE event-specific fields beyond the entity snapshot (validated against the entity schema at the fold; opaque here).",
      "type": [
        "object",
        "null"
      ]
    },
    "reason": {
      "description": "Lifecycle reason (e.g. fault reason for a hardware status transition).",
      "type": [
        "string",
        "null"
      ]
    },
    "related_kit_id": {
      "description": "A related kit (e.g. for kit/roster binding changes).",
      "type": [
        "string",
        "null"
      ]
    },
    "related_unit_id": {
      "description": "A related hardware unit (e.g. for assignments/swaps).",
      "type": [
        "string",
        "null"
      ]
    },
    "schema": {
      "description": "Schema identifier; additive semver (\u00a75).",
      "enum": [
        "eunomia-operational-event/v1"
      ],
      "type": "string"
    }
  },
  "required": [
    "schema",
    "event_id",
    "event_type",
    "entity",
    "entity_id"
  ],
  "title": "OperationalEvent",
  "type": "object"
}
